{
  "$schema": "https://morpheus.aln/schemas/neuro-eco-identity.schema.json",

  "subject_did": "did:bostrom:bostrom18sd2ujv24ual9c9pshtxys6j8knh6xaead9ye7",
  "host_id": "organichain-node-bostrom18-local-01",
  "corridor_id": "corridor:eco:phoenix-local-01",

  "neurorights_profile": {
    "profileId": "bostrom18-default",
    "version": "1.0.0",
    "noNeuralInputsForGovernance": true,
    "rights.noscorefrominnerstate": true,
    "noRemoteControlOverBioState": true,
    "disallowedCapabilities": [
      "remote_biostate_control",
      "remote_neurofeedback_control",
      "offchain_biophysical_actuation",
      "validator_driven_pacing",
      "neural_compliance_scoring"
    ]
  },

  "biomech_policy": {
    "policyId": "bostrom18-biomech-default",
    "version": "1.0.0",
    "deviceId": "morpheus-client-bostrom18-local",
    "hostId": "organichain-node-bostrom18-local-01",
    "biostate_control_origin": "host_local_only",
    "declaredCapabilities": [
      "local_biostate_observation",
      "local_biostate_pacing_advice"
    ]
  }
}
